{
  "schemaVersion": "motor-machine-contract-v1",
  "contractVersion": 1,
  "contractId": "ema6-v1",
  "machineKind": "engine-prototype",
  "identity": {
    "machineId": { "value": "ema6", "evidenceClass": "calibrated", "evidenceRefs": ["src/edwin-gray/edwinGrayEngine.ts:GRAY_MOTORS.ema6.id"], "note": "Exact current engine catalog ID." },
    "name": { "value": "EMA6", "evidenceClass": "calibrated", "evidenceRefs": ["src/edwin-gray/edwinGrayEngine.ts:GRAY_MOTORS.ema6.label"], "note": "Exact current engine catalog label." },
    "source": { "value": "1976 Richard Hackenberger prototype row", "evidenceClass": "calibrated", "evidenceRefs": ["src/edwin-gray/edwinGrayEngine.ts:GRAY_MOTORS.ema6"], "note": "This contract freezes the current engine row without upgrading it to measured machine evidence." },
    "engineModel": { "value": { "year": 1976, "designer": "Richard Hackenberger", "statorPoles": 3, "rotorPoles": 3, "hasRecovery": false, "housing": "aluminum", "leakageCoupling": 0.06, "recoveryCoupling": 0, "observationWindow": false, "chargeVoltageV": 3000, "capacitanceF": 0.0000012, "startRpm": 500, "quenchDeg": 6, "turns": 160 }, "evidenceClass": "calibrated", "evidenceRefs": ["src/edwin-gray/edwinGrayEngine.ts:GRAY_MOTORS.ema6", "src/edwin-gray/edwinGrayEngine.ts:GRAY_PRESETS.ema6"], "note": "Bounded surrogate parameters; they are not physical measurements or FEM identity values." }
  },
  "compatibilityIdentity": {
    "topology": { "value": null, "evidenceClass": "unavailable", "evidenceRefs": ["src/edwin-gray/edwinGrayEngine.ts:GRAY_MOTORS.ema6"], "note": "Pole counts alone do not establish the patent FEM assembly topology." },
    "geometryRevision": { "value": null, "evidenceClass": "unavailable", "evidenceRefs": ["src/edwin-gray/edwinGrayEngine.ts:GRAY_MOTORS.ema6"], "note": "No dimensioned EMA6 geometry revision is available." },
    "windingTurns": { "value": null, "evidenceClass": "unavailable", "evidenceRefs": ["src/edwin-gray/edwinGrayEngine.ts:GRAY_PRESETS.ema6.turns"], "note": "The engine value 160 is calibrated; physical winding and turns evidence is unavailable." },
    "excitationEventSchedule": { "value": null, "evidenceClass": "unavailable", "evidenceRefs": ["src/edwin-gray/edwinGrayEngine.ts:GRAY_PRESETS.ema6"], "note": "Preset voltage, speed, and quench are surrogate inputs, not a documented complete event schedule." },
    "materials": { "value": null, "evidenceClass": "unavailable", "evidenceRefs": ["src/edwin-gray/edwinGrayEngine.ts:GRAY_MOTORS.ema6.housing"], "note": "The aluminum housing label does not specify FEM electromagnetic material laws." },
    "circuit": { "value": null, "evidenceClass": "unavailable", "evidenceRefs": ["src/edwin-gray/edwinGrayEngine.ts:GRAY_MOTORS.ema6.hasRecovery"], "note": "The engine row does not define a complete commutator or conversion-tube circuit revision." },
    "mechanicalLoad": { "value": null, "evidenceClass": "unavailable", "evidenceRefs": ["src/edwin-gray/edwinGrayEngine.ts:GRAY_MOTORS.ema6"], "note": "No machine-specific inertia, friction, or load curve is available." },
    "femAvailability": { "value": { "compatible": false, "caseId": null, "scope": "blocked-unavailable-identity", "runStatus": "not-applicable", "blockedBy": ["topology", "geometryRevision", "windingTurns", "excitationEventSchedule", "materials", "circuit", "mechanicalLoad"] }, "evidenceClass": "unavailable", "evidenceRefs": ["fem/edwin-gray/cases/patent-3890548-illustrative.json:caseId"], "note": "EMA6 must not inherit the patent case assumptions; a machine-specific contract and dimensions are required." }
  },
  "limitations": [
    { "value": "engine-surrogate-not-machine-replica", "evidenceClass": "calibrated", "evidenceRefs": ["src/edwin-gray/edwinGrayEngine.ts:GRAY_MODEL_STATUS"], "note": "The engine row is a bounded classical surrogate." }
  ]
}
